{
  "task_type": "storyboard_planning",
  "product_info": {
    "name": "GlowMist Hydration Serum",
    "category": "beauty_skincare",
    "description": "A lightweight facial serum designed to improve hydration and give the skin a brighter, dewier appearance.",
    "main_benefit": "Makes skin look more hydrated and fresh quickly",
    "secondary_benefits": [
      "lightweight feel",
      "easy daily use",
      "glowy finish"
    ],
    "features": [
      "fast-absorbing serum texture",
      "dropper bottle",
      "daily skincare use"
    ],
    "use_cases": [
      "morning skincare routine",
      "pre-makeup hydration",
      "quick glow boost before going out"
    ],
    "price_positioning": "mid_range",
    "offer_details": "Buy one, get 20% off the second bottle this week",
    "objection_notes": [
      "Will it feel greasy?",
      "Will it actually make a visible difference?",
      "Do I really need another serum?"
    ],
    "proof_assets_available": [
      "demo",
      "creator_reaction",
      "close_up_detail",
      "ugc_review"
    ]
  },
  "target_audience": {
    "segment_name": "young skincare shoppers",
    "demographics": "Women ages 18-30 who care about fresh-looking skin, light makeup prep, and easy skincare routines",
    "pain_points": [
      "skin looks dull",
      "makeup looks dry or flat",
      "heavy skincare feels uncomfortable"
    ],
    "desires": [
      "healthy glow",
      "easy routine",
      "fresh-looking skin without effort"
    ],
    "awareness_level": "solution_aware",
    "skepticism_level": "medium",
    "buying_temperature": "warm"
  },
  "creative_goal": "Turn the serum concept into a short TikTok-style storyboard that feels natural, shows visible application and glow result, and supports product clicks.",
  "video_goal": "direct_conversion",
  "platform": "tiktok",
  "region": "US",
  "video_length_seconds": 18,
  "format_specs": {
    "aspect_ratio": "9:16",
    "orientation": "vertical",
    "style": "ugc",
    "creator_presence": "required"
  },
  "reference_script": "If your skin has been looking so dull lately, this is the one thing that’s been helping mine. It’s this lightweight serum, and I’ve been using it right before makeup or anytime my skin looks tired. It sinks in really fast and doesn’t leave my skin feeling heavy or sticky. It just makes my skin look way more fresh and hydrated almost right away. If you want that easy glow without the heavy feel, tap to check it out.",
  "creator_style": "natural, relatable, friendly, lightly excited, not over-scripted",
  "brand_tone": "fresh, helpful, modern",
  "desired_cta": "Tap to check it out",
  "constraints": {
    "must_include": [
      "visible product application",
      "clear glow result",
      "natural spoken language",
      "simple home setting"
    ],
    "must_avoid": [
      "overly clinical claims",
      "overhyped luxury language",
      "stiff brand-copy tone",
      "complex multi-location scenes"
    ],
    "compliance_notes": [
      "Avoid exaggerated medical or dermatological claims."
    ],
    "production_limits": [
      "single creator shoot",
      "minimal props",
      "simple bathroom or bedroom vanity environment"
    ]
  },
  "notes": "This is a sample storyboard-planning input for a direct-response beauty UGC short video."
}
